root@lamp-s-1vcpu-1gb-tor1-01:~# tcpdump -i eth0^C
18:24:02.382175 IP 198.96.85.104.51244 > lamp-s-1vcpu-1gb-tor1-01.ssh: Flags [.], ack 2144768, win 8190, length 0
18:24:02.382250 IP lamp-s-1vcpu-1gb-tor1-01.ssh > 198.96.85.104.51244: Flags [P.], seq 2147252:2147536, ack 1297, win 316, length 284
18:24:02.382332 IP lamp-s-1vcpu-1gb-tor1-01.ssh > 198.96.85.104.51244: Flags [P.], seq 2147536:2147708, ack 1297, win 316, length 172
18:24:02.382409 IP lamp-s-1vcpu-1gb-tor1-01.ssh > 198.96.85.104.51244: Flags [P.], seq 2147708:2147880, ack 1297, win 316, length 172
18:24:02.382486 IP lamp-s-1vcpu-1gb-tor1-01.ssh > 198.96.85.104.51244: Flags [P.], seq 2147880:2148052, ack 1297, win 316, length 172
18:24:02.382563 IP lamp-s-1vcpu-1gb-tor1-01.ssh > 198.96.85.104.51244: Flags [P.], seq 2148052:2148224, ack 1297, win 316, length 172
18:24:02.382640 IP lamp-s-1vcpu-1gb-tor1-01.ssh > 198.96.85.104.51244: Flags [P.], seq 2148224:2148396, ack 1297, win 316, length 172
18:24:02.382739 IP lamp-s-1vcpu-1gb-tor1-01.ssh > 198.96.85.104.51244: Flags [P.], seq 2148396:2148568, ack 1297, win 316, length 172
18:24:02.382817 IP lamp-s-1vcpu-1gb-tor1-01.ssh > 198.96.85.104.51244: Flags [P.], seq 2148568:2148740, ack 1297, win 316, length 172
18:24:02.382853 IP 198.96.85.104.51244 > lamp-s-1vcpu-1gb-tor1-01.ssh: Flags [.], ack 2145360, win 8193, length 0
18:24:02.382941 IP 198.96.85.104.51244 > lamp-s-1vcpu-1gb-tor1-01.ssh: Flags [.], ack 2146280, win 8190, length 0
18:24:02.382971 IP lamp-s-1vcpu-1gb-tor1-01.ssh > 198.96.85.104.51244: Flags [P.], seq 2148740:2149024, ack 1297, win 316, length 284
18:24:02.383070 IP lamp-s-1vcpu-1gb-tor1-01.ssh > 198.96.85.104.51244: Flags [P.], seq 2149024:2149308, ack 1297, win 316, length 284
18:24:02.383106 IP 198.96.85.104.51244 > lamp-s-1vcpu-1gb-tor1-01.ssh: Flags [.], ack 2147708, win 8193, length 0
18:24:02.383202 IP 198.96.85.104.51244 > lamp-s-1vcpu-1gb-tor1-01.ssh: Flags [.], ack 2147880, win 8193, length 0
18:24:02.383217 IP lamp-s-1vcpu-1gb-tor1-01.ssh > 198.96.85.104.51244: Flags [P.], seq 2149308:2149592, ack 1297, win 316, length 284
18:24:02.383252 IP 198.96.85.104.51244 > lamp-s-1vcpu-1gb-tor1-01.ssh: Flags [.], ack 2148224, win 8191, length 0
18:24:02.383353 IP lamp-s-1vcpu-1gb-tor1-01.ssh > 198.96.85.104.51244: Flags [P.], seq 2149592:2149996, ack 1297, win 316, length 404
18:24:02.383440 IP lamp-s-1vcpu-1gb-tor1-01.ssh > 198.96.85.104.51244: Flags [P.], seq 2149996:2150168, ack 1297, win 316, length 172
18:24:02.383517 IP lamp-s-1vcpu-1gb-tor1-01.ssh > 198.96.85.104.51244: Flags [P.], seq 2150168:2150340, ack 1297, win 316, length 172
18:24:02.383579 IP 198.96.85.104.51244 > lamp-s-1vcpu-1gb-tor1-01.ssh: Flags [.], ack 2148740, win 8189, length 0
18:24:02.383603 IP 198.96.85.104.51244 > lamp-s-1vcpu-1gb-tor1-01.ssh: Flags [.], ack 2149024, win 8188, length 0
18:24:02.383689 IP lamp-s-1vcpu-1gb-tor1-01.ssh > 198.96.85.104.51244: Flags [P.], seq 2150340:2150744, ack 1297, win 316, length 404
18:24:02.383773 IP lamp-s-1vcpu-1gb-tor1-01.ssh > 198.96.85.104.51244: Flags [P.], seq 2150744:2150916, ack 1297, win 316, length 172
18:24:02.383850 IP lamp-s-1vcpu-1gb-tor1-01.ssh > 198.96.85.104.51244: Flags [P.], seq 2150916:2151088, ack 1297, win 316, length 172
18:24:02.383926 IP lamp-s-1vcpu-1gb-tor1-01.ssh > 198.96.85.104.51244: Flags [P.], seq 2151088:2151260, ack 1297, win 316, length 172
18:24:02.383952 IP 198.96.85.104.51244 > lamp-s-1vcpu-1gb-tor1-01.ssh: Flags [.], ack 2149592, win 8193, length 0
18:24:02.384046 IP lamp-s-1vcpu-1gb-tor1-01.ssh > 198.96.85.104.51244: Flags [P.], seq 2151260:2151544, ack 1297, win 316, length 284
18:24:02.384126 IP lamp-s-1vcpu-1gb-tor1-01.ssh > 198.96.85.104.51244: Flags [P.], seq 2151544:2151716, ack 1297, win 316, length 172
18:24:02.384181 IP 198.96.85.104.51244 > lamp-s-1vcpu-1gb-tor1-01.ssh: Flags [.], ack 2150340, win 8190, length 0
18:24:02.384225 IP lamp-s-1vcpu-1gb-tor1-01.ssh > 198.96.85.104.51244: Flags [P.], seq 2151716:2151888, ack 1297, win 316, length 172
18:24:02.384320 IP lamp-s-1vcpu-1gb-tor1-01.ssh > 198.96.85.104.51244: Flags [P.], seq 2151888:2152172, ack 1297, win 316, length 284
18:24:02.384369 IP 198.96.85.104.51244 > lamp-s-1vcpu-1gb-tor1-01.ssh: Flags [.], ack 2150744, win 8189, length 0
18:24:02.384445 IP lamp-s-1vcpu-1gb-tor1-01.ssh > 198.96.85.104.51244: Flags [P.], seq 2152172:2152456, ack 1297, win 316, length 284
18:24:02.384531 IP 198.96.85.104.51244 > lamp-s-1vcpu-1gb-tor1-01.ssh: Flags [.], ack 2151088, win 8193, length 0
18:24:02.384606 IP lamp-s-1vcpu-1gb-tor1-01.ssh > 198.96.85.104.51244: Flags [P.], seq 2152456:2152740, ack 1297, win 316, length 284
18:24:02.384689 IP 198.96.85.104.51244 > lamp-s-1vcpu-1gb-tor1-01.ssh: Flags [.], ack 2151544, win 8191, length 0
18:24:02.384746 IP lamp-s-1vcpu-1gb-tor1-01.ssh > 198.96.85.104.51244: Flags [P.], seq 2152740:2152912, ack 1297, win 316, length 172
18:24:02.384829 IP lamp-s-1vcpu-1gb-tor1-01.ssh > 198.96.85.104.51244: Flags [P.], seq 2152912:2153196, ack 1297, win 316, length 284
18:24:02.384892 IP lamp-s-1vcpu-1gb-tor1-01.ssh > 198.96.85.104.51244: Flags [P.], seq 2153196:2153368, ack 1297, win 316, length 172
18:24:02.384969 IP lamp-s-1vcpu-1gb-tor1-01.ssh > 198.96.85.104.51244: Flags [P.], seq 2153368:2153540, ack 1297, win 316, length 172
18:24:02.384990 IP 198.96.85.104.51244 > lamp-s-1vcpu-1gb-tor1-01.ssh: Flags [.], ack 2151888, win 8190, length 0
18:24:02.385083 IP lamp-s-1vcpu-1gb-tor1-01.ssh > 198.96.85.104.51244: Flags [P.], seq 2153540:2153824, ack 1297, win 316, length 284
18:24:02.385166 IP 198.96.85.104.51244 > lamp-s-1vcpu-1gb-tor1-01.ssh: Flags [.], ack 2152456, win 8188, length 0
18:24:02.385211 IP lamp-s-1vcpu-1gb-tor1-01.ssh > 198.96.85.104.51244: Flags [P.], seq 2153824:2153996, ack 1297, win 316, length 172
18:24:02.385261 IP lamp-s-1vcpu-1gb-tor1-01.ssh > 198.96.85.104.51244: Flags [P.], seq 2153996:2154152, ack 1297, win 316, length 156
18:24:02.385352 IP lamp-s-1vcpu-1gb-tor1-01.ssh > 198.96.85.104.51244: Flags [P.], seq 2154152:2154460, ack 1297, win 316, length 308
18:24:02.385430 IP lamp-s-1vcpu-1gb-tor1-01.ssh > 198.96.85.104.51244: Flags [P.], seq 2154460:2154632, ack 1297, win 316, length 172
18:24:02.385512 IP 198.96.85.104.51244 > lamp-s-1vcpu-1gb-tor1-01.ssh: Flags [.], ack 2153196, win 8193, length 0
18:24:02.385571 IP 198.96.85.104.51244 > lamp-s-1vcpu-1gb-tor1-01.ssh: Flags [.], ack 2153368, win 8193, length 0
18:24:02.385630 IP lamp-s-1vcpu-1gb-tor1-01.ssh > 198.96.85.104.51244: Flags [P.], seq 2154632:2154804, ack 1297, win 316, length 172
18:24:02.385703 IP lamp-s-1vcpu-1gb-tor1-01.ssh > 198.96.85.104.51244: Flags [P.], seq 2154804:2155072, ack 1297, win 316, length 268
18:24:02.385774 IP lamp-s-1vcpu-1gb-tor1-01.ssh > 198.96.85.104.51244: Flags [P.], seq 2155072:2155244, ack 1297, win 316, length 172
18:24:02.385789 IP 198.96.85.104.51244 > lamp-s-1vcpu-1gb-tor1-01.ssh: Flags [.], ack 2153824, win 8191, length 0
18:24:02.385872 IP lamp-s-1vcpu-1gb-tor1-01.ssh > 198.96.85.104.51244: Flags [P.], seq 2155244:2155416, ack 1297, win 316, length 172
18:24:02.385963 IP lamp-s-1vcpu-1gb-tor1-01.ssh > 198.96.85.104.51244: Flags [P.], seq 2155416:2155700, ack 1297, win 316, length 284
18:24:02.386025 IP 198.96.85.104.51244 > lamp-s-1vcpu-1gb-tor1-01.ssh: Flags [.], ack 2154152, win 8190, length 0
18:24:02.386089 IP lamp-s-1vcpu-1gb-tor1-01.ssh > 198.96.85.104.51244: Flags [P.], seq 2155700:2155872, ack 1297, win 316, length 172
18:24:02.386164 IP lamp-s-1vcpu-1gb-tor1-01.ssh > 198.96.85.104.51244: Flags [P.], seq 2155872:2156156, ack 1297, win 316, length 284
18:24:02.386216 IP 198.96.85.104.51244 > lamp-s-1vcpu-1gb-tor1-01.ssh: Flags [.], ack 2154632, win 8193, length 0
18:24:02.386285 IP lamp-s-1vcpu-1gb-tor1-01.ssh > 198.96.85.104.51244: Flags [P.], seq 2156156:2156328, ack 1297, win 316, length 172
18:24:02.386355 IP 198.96.85.104.51244 > lamp-s-1vcpu-1gb-tor1-01.ssh: Flags [.], ack 2155072, win 8192, length 0
18:24:02.386387 IP lamp-s-1vcpu-1gb-tor1-01.ssh > 198.96.85.104.51244: Flags [P.], seq 2156328:2156612, ack 1297, win 316, length 284
18:24:02.386419 IP lamp-s-1vcpu-1gb-tor1-01.ssh > 198.96.85.104.51244: Flags [P.], seq 2156612:2156784, ack 1297, win 316, length 172
18:24:02.386524 IP lamp-s-1vcpu-1gb-tor1-01.ssh > 198.96.85.104.51244: Flags [P.], seq 2156784:2157204, ack 1297, win 316, length 420
18:24:02.386583 IP 198.96.85.104.51244 > lamp-s-1vcpu-1gb-tor1-01.ssh: Flags [.], ack 2155416, win 8190, length 0
18:24:02.386675 IP lamp-s-1vcpu-1gb-tor1-01.ssh > 198.96.85.104.51244: Flags [P.], seq 2157204:2157488, ack 1297, win 316, length 284
18:24:02.386792 IP 198.96.85.104.51244 > lamp-s-1vcpu-1gb-tor1-01.ssh: Flags [.], ack 2155872, win 8188, length 0
18:24:02.386805 IP 198.96.85.104.51244 > lamp-s-1vcpu-1gb-tor1-01.ssh: Flags [P.], seq 1297:1333, ack 2155872, win 8188, length 36
18:24:02.386835 IP 198.96.85.104.51244 > lamp-s-1vcpu-1gb-tor1-01.ssh: Flags [.], ack 2156156, win 8193, length 0
18:24:02.386965 IP 198.96.85.104.51244 > lamp-s-1vcpu-1gb-tor1-01.ssh: Flags [.], ack 2156328, win 8193, length 0
18:24:02.387036 IP lamp-s-1vcpu-1gb-tor1-01.ssh > 198.96.85.104.51244: Flags [P.], seq 2157488:2158020, ack 1333, win 316, length 532
18:24:02.387116 IP lamp-s-1vcpu-1gb-tor1-01.ssh > 198.96.85.104.51244: Flags [P.], seq 2158020:2158176, ack 1333, win 316, length 156
18:24:02.387189 IP lamp-s-1vcpu-1gb-tor1-01.ssh > 198.96.85.104.51244: Flags [P.], seq 2158176:2158348, ack 1333, win 316, length 172
18:24:02.387257 IP 198.96.85.104.51244 > lamp-s-1vcpu-1gb-tor1-01.ssh: Flags [.], ack 2156784, win 8191, length 0
18:24:02.387323 IP lamp-s-1vcpu-1gb-tor1-01.ssh > 198.96.85.104.51244: Flags [P.], seq 2158348:2158520, ack 1333, win 316, length 172
18:24:02.387401 IP lamp-s-1vcpu-1gb-tor1-01.ssh > 198.96.85.104.51244: Flags [P.], seq 2158520:2158804, ack 1333, win 316, length 284
18:24:02.387474 IP lamp-s-1vcpu-1gb-tor1-01.ssh > 198.96.85.104.51244: Flags [P.], seq 2158804:2158976, ack 1333, win 316, length 172
18:24:02.387499 IP 198.96.85.104.51244 > lamp-s-1vcpu-1gb-tor1-01.ssh: Flags [.], ack 2157488, win 8188, length 0
18:24:02.387586 IP lamp-s-1vcpu-1gb-tor1-01.ssh > 198.96.85.104.51244: Flags [P.], seq 2158976:2159148, ack 1333, win 316, length 172
18:24:02.387624 IP lamp-s-1vcpu-1gb-tor1-01.ssh > 198.96.85.104.51244: Flags [P.], seq 2159148:2159432, ack 1333, win 316, length 284
18:24:02.387725 IP lamp-s-1vcpu-1gb-tor1-01.ssh > 198.96.85.104.51244: Flags [P.], seq 2159432:2159740, ack 1333, win 316, length 308
18:24:02.387838 IP lamp-s-1vcpu-1gb-tor1-01.ssh > 198.96.85.104.51244: Flags [P.], seq 2159740:2159912, ack 1333, win 316, length 172
18:24:02.387892 IP 198.96.85.104.51244 > lamp-s-1vcpu-1gb-tor1-01.ssh: Flags [.], ack 2158348, win 8193, length 0
18:24:02.387973 IP lamp-s-1vcpu-1gb-tor1-01.ssh > 198.96.85.104.51244: Flags [P.], seq 2159912:2160196, ack 1333, win 316, length 284
18:24:02.388010 IP 198.96.85.104.51244 > lamp-s-1vcpu-1gb-tor1-01.ssh: Flags [.], ack 2158804, win 8191, length 0
18:24:02.388100 IP lamp-s-1vcpu-1gb-tor1-01.ssh > 198.96.85.104.51244: Flags [P.], seq 2160196:2160480, ack 1333, win 316, length 284
18:24:02.388161 IP 198.96.85.104.51244 > lamp-s-1vcpu-1gb-tor1-01.ssh: Flags [.], ack 2158976, win 8191, length 0
18:24:02.388208 IP lamp-s-1vcpu-1gb-tor1-01.ssh > 198.96.85.104.51244: Flags [P.], seq 2160480:2160652, ack 1333, win 316, length 172
18:24:02.388324 IP lamp-s-1vcpu-1gb-tor1-01.ssh > 198.96.85.104.51244: Flags [P.], seq 2160652:2160936, ack 1333, win 316, length 284
18:24:02.388352 IP 198.96.85.104.51244 > lamp-s-1vcpu-1gb-tor1-01.ssh: Flags [.], ack 2159432, win 8189, length 0
18:24:02.388462 IP lamp-s-1vcpu-1gb-tor1-01.ssh > 198.96.85.104.51244: Flags [P.], seq 2160936:2161220, ack 1333, win 316, length 284
18:24:02.388562 IP lamp-s-1vcpu-1gb-tor1-01.ssh > 198.96.85.104.51244: Flags [P.], seq 2161220:2161392, ack 1333, win 316, length 172
18:24:02.388622 IP 198.96.85.104.51244 > lamp-s-1vcpu-1gb-tor1-01.ssh: Flags [.], ack 2159912, win 8193, length 0
18:24:02.388699 IP lamp-s-1vcpu-1gb-tor1-01.ssh > 198.96.85.104.51244: Flags [P.], seq 2161392:2161676, ack 1333, win 316, length 284
18:24:02.388794 IP lamp-s-1vcpu-1gb-tor1-01.ssh > 198.96.85.104.51244: Flags [P.], seq 2161676:2161848, ack 1333, win 316, length 172
18:24:02.388812 IP 198.96.85.104.51244 > lamp-s-1vcpu-1gb-tor1-01.ssh: Flags [.], ack 2160480, win 8191, length 0
18:24:02.388916 IP lamp-s-1vcpu-1gb-tor1-01.ssh > 198.96.85.104.51244: Flags [P.], seq 2161848:2162132, ack 1333, win 316, length 284
18:24:02.389006 IP lamp-s-1vcpu-1gb-tor1-01.ssh > 198.96.85.104.51244: Flags [P.], seq 2162132:2162304, ack 1333, win 316, length 172
18:24:02.389028 IP 198.96.85.104.51244 > lamp-s-1vcpu-1gb-tor1-01.ssh: Flags [.], ack 2160936, win 8189, length 0
18:24:02.389145 IP lamp-s-1vcpu-1gb-tor1-01.ssh > 198.96.85.104.51244: Flags [P.], seq 2162304:2162588, ack 1333, win 316, length 284
18:24:02.389248 IP lamp-s-1vcpu-1gb-tor1-01.ssh > 198.96.85.104.51244: Flags [P.], seq 2162588:2162760, ack 1333, win 316, length 172
18:24:02.389278 IP 198.96.85.104.51244 > lamp-s-1vcpu-1gb-tor1-01.ssh: Flags [.], ack 2161392, win 8193, length 0
18:24:02.389408 IP lamp-s-1vcpu-1gb-tor1-01.ssh > 198.96.85.104.51244: Flags [P.], seq 2162760:2163044, ack 1333, win 316, length 284
18:24:02.389469 IP 198.96.85.104.51244 > lamp-s-1vcpu-1gb-tor1-01.ssh: Flags [.], ack 2161848, win 8191, length 0
18:24:02.389552 IP lamp-s-1vcpu-1gb-tor1-01.ssh > 198.96.85.104.51244: Flags [P.], seq 2163044:2163328, ack 1333, win 316, length 284
18:24:02.389641 IP lamp-s-1vcpu-1gb-tor1-01.ssh > 198.96.85.104.51244: Flags [P.], seq 2163328:2163500, ack 1333, win 316, length 172
18:24:02.389702 IP 198.96.85.104.51244 > lamp-s-1vcpu-1gb-tor1-01.ssh: Flags [.], ack 2162304, win 8190, length 0
18:24:02.389782 IP lamp-s-1vcpu-1gb-tor1-01.ssh > 198.96.85.104.51244: Flags [P.], seq 2163500:2163784, ack 1333, win 316, length 284
18:24:02.389866 IP lamp-s-1vcpu-1gb-tor1-01.ssh > 198.96.85.104.51244: Flags [P.], seq 2163784:2163956, ack 1333, win 316, length 172
18:24:02.389924 IP 198.96.85.104.51244 > lamp-s-1vcpu-1gb-tor1-01.ssh: Flags [.], ack 2162760, win 8188, length 0
18:24:02.390012 IP lamp-s-1vcpu-1gb-tor1-01.ssh > 198.96.85.104.51244: Flags [P.], seq 2163956:2164240, ack 1333, win 316, length 284
18:24:02.390113 IP lamp-s-1vcpu-1gb-tor1-01.ssh > 198.96.85.104.51244: Flags [P.], seq 2164240:2164412, ack 1333, win 316, length 172
18:24:02.390193 IP lamp-s-1vcpu-1gb-tor1-01.ssh > 198.96.85.104.51244: Flags [P.], seq 2164412:2164584, ack 1333, win 316, length 172
18:24:02.390271 IP 198.96.85.104.51244 > lamp-s-1vcpu-1gb-tor1-01.ssh: Flags [.], ack 2163500, win 8193, length 0
18:24:02.390340 IP lamp-s-1vcpu-1gb-tor1-01.ssh > 198.96.85.104.51244: Flags [P.], seq 2164584:2164756, ack 1333, win 316, length 172
18:24:02.390419 IP 198.96.85.104.51244 > lamp-s-1vcpu-1gb-tor1-01.ssh: Flags [.], ack 2163784, win 8192, length 0
18:24:02.390433 IP lamp-s-1vcpu-1gb-tor1-01.ssh > 198.96.85.104.51244: Flags [P.], seq 2164756:2164912, ack 1333, win 316, length 156
18:24:02.390527 IP lamp-s-1vcpu-1gb-tor1-01.ssh > 198.96.85.104.51244: Flags [P.], seq 2164912:2165084, ack 1333, win 316, length 172
18:24:02.390603 IP lamp-s-1vcpu-1gb-tor1-01.ssh > 198.96.85.104.51244: Flags [P.], seq 2165084:2165368, ack 1333, win 316, length 284
18:24:02.390637 IP lamp-s-1vcpu-1gb-tor1-01.ssh > 198.96.85.104.51244: Flags [P.], seq 2165368:2165540, ack 1333, win 316, length 172
18:24:02.390742 IP lamp-s-1vcpu-1gb-tor1-01.ssh > 198.96.85.104.51244: Flags [P.], seq 2165540:2165848, ack 1333, win 316, length 308
18:24:02.390765 IP 198.96.85.104.51244 > lamp-s-1vcpu-1gb-tor1-01.ssh: Flags [.], ack 2164412, win 8190, length 0
18:24:02.390827 IP 198.96.85.104.51244 > lamp-s-1vcpu-1gb-tor1-01.ssh: Flags [.], ack 2164584, win 8189, length 0
18:24:02.390905 IP lamp-s-1vcpu-1gb-tor1-01.ssh > 198.96.85.104.51244: Flags [P.], seq 2165848:2166252, ack 1333, win 316, length 404
18:24:02.390991 IP lamp-s-1vcpu-1gb-tor1-01.ssh > 198.96.85.104.51244: Flags [P.], seq 2166252:2166424, ack 1333, win 316, length 172
18:24:02.391075 IP lamp-s-1vcpu-1gb-tor1-01.ssh > 198.96.85.104.51244: Flags [P.], seq 2166424:2166596, ack 1333, win 316, length 172
18:24:02.391149 IP 198.96.85.104.51244 > lamp-s-1vcpu-1gb-tor1-01.ssh: Flags [.], ack 2164912, win 8193, length 0
18:24:02.391216 IP lamp-s-1vcpu-1gb-tor1-01.ssh > 198.96.85.104.51244: Flags [P.], seq 2166596:2166768, ack 1333, win 316, length 172
18:24:02.391296 IP 198.96.85.104.51244 > lamp-s-1vcpu-1gb-tor1-01.ssh: Flags [.], ack 2165540, win 8191, length 0
18:24:02.391376 IP lamp-s-1vcpu-1gb-tor1-01.ssh > 198.96.85.104.51244: Flags [P.], seq 2166768:2166924, ack 1333, win 316, length 156
18:24:02.391454 IP 198.96.85.104.51244 > lamp-s-1vcpu-1gb-tor1-01.ssh: Flags [.], ack 2165848, win 8190, length 0
18:24:02.391468 IP lamp-s-1vcpu-1gb-tor1-01.ssh > 198.96.85.104.51244: Flags [P.], seq 2166924:2167208, ack 1333, win 316, length 284
18:24:02.391596 IP lamp-s-1vcpu-1gb-tor1-01.ssh > 198.96.85.104.51244: Flags [P.], seq 2167208:2167628, ack 1333, win 316, length 420
18:24:02.391685 IP 198.96.85.104.51244 > lamp-s-1vcpu-1gb-tor1-01.ssh: Flags [.], ack 2166424, win 8193, length 0
18:24:02.391734 IP lamp-s-1vcpu-1gb-tor1-01.ssh > 198.96.85.104.51244: Flags [P.], seq 2167628:2167800, ack 1333, win 316, length 172
18:24:02.391820 IP lamp-s-1vcpu-1gb-tor1-01.ssh > 198.96.85.104.51244: Flags [P.], seq 2167800:2168084, ack 1333, win 316, length 284
18:24:02.391904 IP lamp-s-1vcpu-1gb-tor1-01.ssh > 198.96.85.104.51244: Flags [P.], seq 2168084:2168256, ack 1333, win 316, length 172
18:24:02.391932 IP 198.96.85.104.51244 > lamp-s-1vcpu-1gb-tor1-01.ssh: Flags [.], ack 2166768, win 8192, length 0
18:24:02.392027 IP lamp-s-1vcpu-1gb-tor1-01.ssh > 198.96.85.104.51244: Flags [P.], seq 2168256:2168540, ack 1333, win 316, length 284
18:24:02.392110 IP lamp-s-1vcpu-1gb-tor1-01.ssh > 198.96.85.104.51244: Flags [P.], seq 2168540:2168712, ack 1333, win 316, length 172
18:24:02.392187 IP lamp-s-1vcpu-1gb-tor1-01.ssh > 198.96.85.104.51244: Flags [P.], seq 2168712:2168884, ack 1333, win 316, length 172
18:24:02.392206 IP 198.96.85.104.51244 > lamp-s-1vcpu-1gb-tor1-01.ssh: Flags [.], ack 2167208, win 8190, length 0
18:24:02.392300 IP lamp-s-1vcpu-1gb-tor1-01.ssh > 198.96.85.104.51244: Flags [P.], seq 2168884:2169168, ack 1333, win 316, length 284
18:24:02.392381 IP lamp-s-1vcpu-1gb-tor1-01.ssh > 198.96.85.104.51244: Flags [P.], seq 2169168:2169340, ack 1333, win 316, length 172
18:24:02.392414 IP 198.96.85.104.51244 > lamp-s-1vcpu-1gb-tor1-01.ssh: Flags [.], ack 2167800, win 8188, length 0
18:24:02.392504 IP lamp-s-1vcpu-1gb-tor1-01.ssh > 198.96.85.104.51244: Flags [P.], seq 2169340:2169624, ack 1333, win 316, length 284
18:24:02.392587 IP lamp-s-1vcpu-1gb-tor1-01.ssh > 198.96.85.104.51244: Flags [P.], seq 2169624:2169796, ack 1333, win 316, length 172
18:24:02.392619 IP 198.96.85.104.51244 > lamp-s-1vcpu-1gb-tor1-01.ssh: Flags [.], ack 2168256, win 8193, length 0
18:24:02.392707 IP lamp-s-1vcpu-1gb-tor1-01.ssh > 198.96.85.104.51244: Flags [P.], seq 2169796:2170080, ack 1333, win 316, length 284
18:24:02.392810 IP lamp-s-1vcpu-1gb-tor1-01.ssh > 198.96.85.104.51244: Flags [P.], seq 2170080:2170252, ack 1333, win 316, length 172
18:24:02.392831 IP 198.96.85.104.51244 > lamp-s-1vcpu-1gb-tor1-01.ssh: Flags [.], ack 2168712, win 8191, length 0
18:24:02.392951 IP lamp-s-1vcpu-1gb-tor1-01.ssh > 198.96.85.104.51244: Flags [P.], seq 2170252:2170536, ack 1333, win 316, length 284
18:24:02.392980 IP 198.96.85.104.51244 > lamp-s-1vcpu-1gb-tor1-01.ssh: Flags [.], ack 2169168, win 8190, length 0
18:24:02.393075 IP lamp-s-1vcpu-1gb-tor1-01.ssh > 198.96.85.104.51244: Flags [P.], seq 2170536:2170820, ack 1333, win 316, length 284
18:24:02.393158 IP lamp-s-1vcpu-1gb-tor1-01.ssh > 198.96.85.104.51244: Flags [P.], seq 2170820:2170992, ack 1333, win 316, length 172
18:24:02.393178 IP 198.96.85.104.51244 > lamp-s-1vcpu-1gb-tor1-01.ssh: Flags [.], ack 2169624, win 8188, length 0
18:24:02.393270 IP lamp-s-1vcpu-1gb-tor1-01.ssh > 198.96.85.104.51244: Flags [P.], seq 2170992:2171276, ack 1333, win 316, length 284
18:24:02.393351 IP lamp-s-1vcpu-1gb-tor1-01.ssh > 198.96.85.104.51244: Flags [P.], seq 2171276:2171448, ack 1333, win 316, length 172
18:24:02.393446 IP lamp-s-1vcpu-1gb-tor1-01.ssh > 198.96.85.104.51244: Flags [P.], seq 2171448:2171620, ack 1333, win 316, length 172
18:24:02.393501 IP 198.96.85.104.51244 > lamp-s-1vcpu-1gb-tor1-01.ssh: Flags [.], ack 2170080, win 8193, length 0
18:24:02.393576 IP lamp-s-1vcpu-1gb-tor1-01.ssh > 198.96.85.104.51244: Flags [P.], seq 2171620:2171904, ack 1333, win 316, length 284
18:24:02.393664 IP lamp-s-1vcpu-1gb-tor1-01.ssh > 198.96.85.104.51244: Flags [P.], seq 2171904:2172076, ack 1333, win 316, length 172
18:24:02.393722 IP 198.96.85.104.51244 > lamp-s-1vcpu-1gb-tor1-01.ssh: Flags [.], ack 2170536, win 8191, length 0
18:24:02.393774 IP 198.96.85.104.51244 > lamp-s-1vcpu-1gb-tor1-01.ssh: Flags [.], ack 2170992, win 8190, length 0
18:24:02.393782 IP lamp-s-1vcpu-1gb-tor1-01.ssh > 198.96.85.104.51244: Flags [P.], seq 2172076:2172248, ack 1333, win 316, length 172
18:24:02.393919 IP lamp-s-1vcpu-1gb-tor1-01.ssh > 198.96.85.104.51244: Flags [P.], seq 2172248:2172652, ack 1333, win 316, length 404
18:24:02.394002 IP lamp-s-1vcpu-1gb-tor1-01.ssh > 198.96.85.104.51244: Flags [P.], seq 2172652:2172824, ack 1333, win 316, length 172
18:24:02.394036 IP 198.96.85.104.51244 > lamp-s-1vcpu-1gb-tor1-01.ssh: Flags [.], ack 2171448, win 8188, length 0
18:24:02.394128 IP lamp-s-1vcpu-1gb-tor1-01.ssh > 198.96.85.104.51244: Flags [P.], seq 2172824:2173108, ack 1333, win 316, length 284
18:24:02.394210 IP lamp-s-1vcpu-1gb-tor1-01.ssh > 198.96.85.104.51244: Flags [P.], seq 2173108:2173280, ack 1333, win 316, length 172
18:24:02.394287 IP 198.96.85.104.51244 > lamp-s-1vcpu-1gb-tor1-01.ssh: Flags [.], ack 2171904, win 8193, length 0
18:24:02.394359 IP lamp-s-1vcpu-1gb-tor1-01.ssh > 198.96.85.104.51244: Flags [P.], seq 2173280:2173452, ack 1333, win 316, length 172
18:24:02.394435 IP lamp-s-1vcpu-1gb-tor1-01.ssh > 198.96.85.104.51244: Flags [P.], seq 2173452:2173608, ack 1333, win 316, length 156
18:24:02.394485 IP 198.96.85.104.51244 > lamp-s-1vcpu-1gb-tor1-01.ssh: Flags [.], ack 2172248, win 8192, length 0
18:24:02.394567 IP lamp-s-1vcpu-1gb-tor1-01.ssh > 198.96.85.104.51244: Flags [P.], seq 2173608:2173780, ack 1333, win 316, length 172
18:24:02.394657 IP lamp-s-1vcpu-1gb-tor1-01.ssh > 198.96.85.104.51244: Flags [P.], seq 2173780:2174064, ack 1333, win 316, length 284
18:24:02.394678 IP 198.96.85.104.51244 > lamp-s-1vcpu-1gb-tor1-01.ssh: Flags [.], ack 2172824, win 8190, length 0
18:24:02.394773 IP lamp-s-1vcpu-1gb-tor1-01.ssh > 198.96.85.104.51244: Flags [P.], seq 2174064:2174236, ack 1333, win 316, length 172
18:24:02.394854 IP lamp-s-1vcpu-1gb-tor1-01.ssh > 198.96.85.104.51244: Flags [P.], seq 2174236:2174520, ack 1333, win 316, length 284
18:24:02.394881 IP 198.96.85.104.51244 > lamp-s-1vcpu-1gb-tor1-01.ssh: Flags [.], ack 2173280, win 8188, length 0
18:24:02.394968 IP lamp-s-1vcpu-1gb-tor1-01.ssh > 198.96.85.104.51244: Flags [P.], seq 2174520:2174692, ack 1333, win 316, length 172
18:24:02.395006 IP lamp-s-1vcpu-1gb-tor1-01.ssh > 198.96.85.104.51244: Flags [P.], seq 2174692:2174976, ack 1333, win 316, length 284
18:24:02.395099 IP lamp-s-1vcpu-1gb-tor1-01.ssh > 198.96.85.104.51244: Flags [P.], seq 2174976:2175284, ack 1333, win 316, length 308
18:24:02.395136 IP 198.96.85.104.51244 > lamp-s-1vcpu-1gb-tor1-01.ssh: Flags [.], ack 2173608, win 8193, length 0
18:24:02.395222 IP lamp-s-1vcpu-1gb-tor1-01.ssh > 198.96.85.104.51244: Flags [P.], seq 2175284:2175568, ack 1333, win 316, length 284
18:24:02.395303 IP lamp-s-1vcpu-1gb-tor1-01.ssh > 198.96.85.104.51244: Flags [P.], seq 2175568:2175740, ack 1333, win 316, length 172
18:24:02.395357 IP 198.96.85.104.51244 > lamp-s-1vcpu-1gb-tor1-01.ssh: Flags [.], ack 2174064, win 8191, length 0
18:24:02.395430 IP lamp-s-1vcpu-1gb-tor1-01.ssh > 198.96.85.104.51244: Flags [P.], seq 2175740:2176024, ack 1333, win 316, length 284
18:24:02.395516 IP lamp-s-1vcpu-1gb-tor1-01.ssh > 198.96.85.104.51244: Flags [P.], seq 2176024:2176196, ack 1333, win 316, length 172
18:24:02.395581 IP 198.96.85.104.51244 > lamp-s-1vcpu-1gb-tor1-01.ssh: Flags [.], ack 2174520, win 8190, length 0
18:24:02.395641 IP 198.96.85.104.51244 > lamp-s-1vcpu-1gb-tor1-01.ssh: Flags [.], ack 2174976, win 8188, length 0
18:24:02.395677 IP lamp-s-1vcpu-1gb-tor1-01.ssh > 198.96.85.104.51244: Flags [P.], seq 2176196:2176480, ack 1333, win 316, length 284
18:24:02.395834 IP lamp-s-1vcpu-1gb-tor1-01.ssh > 198.96.85.104.51244: Flags [P.], seq 2176480:2176764, ack 1333, win 316, length 284
18:24:02.395918 IP 198.96.85.104.51244 > lamp-s-1vcpu-1gb-tor1-01.ssh: Flags [P.], seq 1333:1369, ack 2175284, win 8193, length 36
18:24:02.395996 IP lamp-s-1vcpu-1gb-tor1-01.ssh > 198.96.85.104.51244: Flags [P.], seq 2176764:2176936, ack 1369, win 316, length 172
18:24:02.396018 IP 198.96.85.104.51244 > lamp-s-1vcpu-1gb-tor1-01.ssh: Flags [.], ack 2175740, win 8191, length 0
