18:31:34.234714 IP 198.96.85.104.51244 > 138.197.169.181.22: Flags [.], ack 4071000, win 8193, length 0
18:31:34.234801 IP 138.197.169.181.22 > 198.96.85.104.51244: Flags [P.], seq 4072288:4072660, ack 2449, win 316, length 372
18:31:34.234879 IP 138.197.169.181.22 > 198.96.85.104.51244: Flags [P.], seq 4072660:4072824, ack 2449, win 316, length 164
18:31:34.234952 IP 138.197.169.181.22 > 198.96.85.104.51244: Flags [P.], seq 4072824:4072988, ack 2449, win 316, length 164
18:31:34.235024 IP 138.197.169.181.22 > 198.96.85.104.51244: Flags [P.], seq 4072988:4073152, ack 2449, win 316, length 164
18:31:34.235072 IP 198.96.85.104.51244 > 138.197.169.181.22: Flags [.], ack 4071700, win 8190, length 0
18:31:34.235142 IP 138.197.169.181.22 > 198.96.85.104.51244: Flags [P.], seq 4073152:4073420, ack 2449, win 316, length 268
18:31:34.235227 IP 198.96.85.104.51244 > 138.197.169.181.22: Flags [.], ack 4071864, win 8189, length 0
18:31:34.235266 IP 138.197.169.181.22 > 198.96.85.104.51244: Flags [P.], seq 4073420:4073584, ack 2449, win 316, length 164
18:31:34.235360 IP 138.197.169.181.22 > 198.96.85.104.51244: Flags [P.], seq 4073584:4073852, ack 2449, win 316, length 268
18:31:34.235434 IP 138.197.169.181.22 > 198.96.85.104.51244: Flags [P.], seq 4073852:4074016, ack 2449, win 316, length 164
18:31:34.235467 IP 198.96.85.104.51244 > 138.197.169.181.22: Flags [.], ack 4072288, win 8193, length 0
18:31:34.235550 IP 138.197.169.181.22 > 198.96.85.104.51244: Flags [P.], seq 4074016:4074284, ack 2449, win 316, length 268
18:31:34.235605 IP 198.96.85.104.51244 > 138.197.169.181.22: Flags [.], ack 4072824, win 8191, length 0
18:31:34.235675 IP 198.96.85.104.51244 > 138.197.169.181.22: Flags [.], ack 4073152, win 8190, length 0
18:31:34.235730 IP 138.197.169.181.22 > 198.96.85.104.51244: Flags [P.], seq 4074284:4074552, ack 2449, win 316, length 268
18:31:34.235775 IP 138.197.169.181.22 > 198.96.85.104.51244: Flags [P.], seq 4074552:4074692, ack 2449, win 316, length 140
18:31:34.235861 IP 138.197.169.181.22 > 198.96.85.104.51244: Flags [P.], seq 4074692:4074976, ack 2449, win 316, length 284
18:31:34.235931 IP 198.96.85.104.51244 > 138.197.169.181.22: Flags [.], ack 4073584, win 8188, length 0
18:31:34.235992 IP 138.197.169.181.22 > 198.96.85.104.51244: Flags [P.], seq 4074976:4075140, ack 2449, win 316, length 164
18:31:34.236055 IP 198.96.85.104.51244 > 138.197.169.181.22: Flags [.], ack 4074016, win 8193, length 0
18:31:34.236112 IP 138.197.169.181.22 > 198.96.85.104.51244: Flags [P.], seq 4075140:4075280, ack 2449, win 316, length 140
18:31:34.236181 IP 138.197.169.181.22 > 198.96.85.104.51244: Flags [P.], seq 4075280:4075548, ack 2449, win 316, length 268
18:31:34.236247 IP 138.197.169.181.22 > 198.96.85.104.51244: Flags [P.], seq 4075548:4075712, ack 2449, win 316, length 164
18:31:34.236313 IP 138.197.169.181.22 > 198.96.85.104.51244: Flags [P.], seq 4075712:4075876, ack 2449, win 316, length 164
18:31:34.236378 IP 138.197.169.181.22 > 198.96.85.104.51244: Flags [P.], seq 4075876:4076040, ack 2449, win 316, length 164
18:31:34.236428 IP 198.96.85.104.51244 > 138.197.169.181.22: Flags [.], ack 4074692, win 8191, length 0
18:31:34.236491 IP 138.197.169.181.22 > 198.96.85.104.51244: Flags [P.], seq 4076040:4076204, ack 2449, win 316, length 164
18:31:34.236514 IP 198.96.85.104.51244 > 138.197.169.181.22: Flags [.], ack 4074976, win 8190, length 0
18:31:34.236596 IP 138.197.169.181.22 > 198.96.85.104.51244: Flags [P.], seq 4076204:4076472, ack 2449, win 316, length 268
18:31:34.236628 IP 138.197.169.181.22 > 198.96.85.104.51244: Flags [P.], seq 4076472:4076740, ack 2449, win 316, length 268
18:31:34.236713 IP 138.197.169.181.22 > 198.96.85.104.51244: Flags [P.], seq 4076740:4077024, ack 2449, win 316, length 284
18:31:34.236770 IP 198.96.85.104.51244 > 138.197.169.181.22: Flags [.], ack 4075548, win 8193, length 0
18:31:34.236840 IP 138.197.169.181.22 > 198.96.85.104.51244: Flags [P.], seq 4077024:4077292, ack 2449, win 316, length 268
root@lamp-s-1vcpu-1gb-tor1-01:~# tcpdump -n -i eth0
18:31:34.236885 IP 198.96.85.104.51244 > 138.197.169.181.22: Flags [.], ack 4075712, win 8193, length 0
18:31:34.236961 IP 138.197.169.181.22 > 198.96.85.104.51244: Flags [P.], seq 4077292:4077560, ack 2449, win 316, length 268
18:31:34.237039 IP 198.96.85.104.51244 > 138.197.169.181.22: Flags [.], ack 4076040, win 8191, length 0
18:31:34.237093 IP 138.197.169.181.22 > 198.96.85.104.51244: Flags [P.], seq 4077560:4077724, ack 2449, win 316, length 164
18:31:34.237168 IP 138.197.169.181.22 > 198.96.85.104.51244: Flags [P.], seq 4077724:4077992, ack 2449, win 316, length 268
18:31:34.237241 IP 138.197.169.181.22 > 198.96.85.104.51244: Flags [P.], seq 4077992:4078156, ack 2449, win 316, length 164
18:31:34.237259 IP 198.96.85.104.51244 > 138.197.169.181.22: Flags [.], ack 4076740, win 8189, length 0
18:31:34.237325 IP 198.96.85.104.51244 > 138.197.169.181.22: Flags [.], ack 4077024, win 8193, length 0
18:31:34.237373 IP 138.197.169.181.22 > 198.96.85.104.51244: Flags [P.], seq 4078156:4078424, ack 2449, win 316, length 268
18:31:34.237465 IP 138.197.169.181.22 > 198.96.85.104.51244: Flags [P.], seq 4078424:4078692, ack 2449, win 316, length 268
18:31:34.237539 IP 138.197.169.181.22 > 198.96.85.104.51244: Flags [P.], seq 4078692:4078856, ack 2449, win 316, length 164
18:31:34.237612 IP 138.197.169.181.22 > 198.96.85.104.51244: Flags [P.], seq 4078856:4079020, ack 2449, win 316, length 164
18:31:34.237684 IP 138.197.169.181.22 > 198.96.85.104.51244: Flags [P.], seq 4079020:4079184, ack 2449, win 316, length 164
18:31:34.237757 IP 138.197.169.181.22 > 198.96.85.104.51244: Flags [P.], seq 4079184:4079348, ack 2449, win 316, length 164
18:31:34.237776 IP 198.96.85.104.51244 > 138.197.169.181.22: Flags [.], ack 4077724, win 8191, length 0
18:31:34.237822 IP 198.96.85.104.51244 > 138.197.169.181.22: Flags [.], ack 4077992, win 8189, length 0
18:31:34.237942 IP 138.197.169.181.22 > 198.96.85.104.51244: Flags [P.], seq 4079348:4079720, ack 2449, win 316, length 372
18:31:34.238023 IP 138.197.169.181.22 > 198.96.85.104.51244: Flags [P.], seq 4079720:4079884, ack 2449, win 316, length 164
18:31:34.238088 IP 198.96.85.104.51244 > 138.197.169.181.22: Flags [.], ack 4078692, win 8193, length 0
18:31:34.238157 IP 138.197.169.181.22 > 198.96.85.104.51244: Flags [P.], seq 4079884:4080152, ack 2449, win 316, length 268
18:31:34.238174 IP 198.96.85.104.51244 > 138.197.169.181.22: Flags [.], ack 4078856, win 8193, length 0
18:31:34.238261 IP 138.197.169.181.22 > 198.96.85.104.51244: Flags [P.], seq 4080152:4080420, ack 2449, win 316, length 268
18:31:34.238337 IP 138.197.169.181.22 > 198.96.85.104.51244: Flags [P.], seq 4080420:4080584, ack 2449, win 316, length 164
18:31:34.238360 IP 198.96.85.104.51244 > 138.197.169.181.22: Flags [.], ack 4079184, win 8191, length 0
18:31:34.238448 IP 138.197.169.181.22 > 198.96.85.104.51244: Flags [P.], seq 4080584:4080852, ack 2449, win 316, length 268
18:31:34.238526 IP 138.197.169.181.22 > 198.96.85.104.51244: Flags [P.], seq 4080852:4081016, ack 2449, win 316, length 164
18:31:34.238599 IP 138.197.169.181.22 > 198.96.85.104.51244: Flags [P.], seq 4081016:4081180, ack 2449, win 316, length 164
18:31:34.238672 IP 138.197.169.181.22 > 198.96.85.104.51244: Flags [P.], seq 4081180:4081344, ack 2449, win 316, length 164
18:31:34.238698 IP 198.96.85.104.51244 > 138.197.169.181.22: Flags [.], ack 4079720, win 8189, length 0
18:31:34.238784 IP 138.197.169.181.22 > 198.96.85.104.51244: Flags [P.], seq 4081344:4081612, ack 2449, win 316, length 268
18:31:34.238863 IP 138.197.169.181.22 > 198.96.85.104.51244: Flags [P.], seq 4081612:4081776, ack 2449, win 316, length 164
^C
28544 packets captured
28590 packets received by filter
43 packets dropped by kernel
